file_name,uni,wylie,url,dept,grade,char_len,audio_len,path,inf
STT_CS-D-2010-M-D-B07-4-R-01_0083_611001_to_619185,ཨེ་ནས། ཟ་ཁང་ཀ་ཅི་ཝེཋར་བསླེབས་རེད་ད། ཝེཋར་བསླེབས་ནས་མི་འདུག་བས། ཁོ་ལ་ཨན་འདྲའི་ལབ་རེད་ད། ད་ཁ་ལག་ག་རེ་བཟའ་གས། བདམས་ཚར་ཡིན་པས་ལབ་རེད་ད་རཱ། ཨེ་ནས་ཁོས་འོ་ང་ལ་མོག་མོག ,e nas/_za khang ka ci weThar bslebs red da/_weThar bslebs nas mi 'dug bas/_kho la an 'dra'i lab red da/_da kha lag ga re bza' gas/_bdams tshar yin pas lab red da rA/_e nas khos 'o nga la mog mog_,https://d38pmlk0v88drf.cloudfront.net/wav16k/STT_CS-D-2010-M-D-B07-4-R-01_0083_611001_to_619185.wav,STT_CS,3,160,8.184,wav16k/STT_CS-D-2010-M-D-B07-4-R-01_0083_611001_to_619185.wav,ཨེ་ནས་ཟ་ཁང་ཀ་ཅི་ཝི་ཋེར་སླེབས་རེད་ད་ཱ། ཝི་ཋོར་སླེབས་ནས་མི་འདུག་གས། ཁོ་ལ་ཨེ་འདྲའི་ལབ་རེད་ད་རཱ། ད་ཁ་ལག་ག་རེ་ཟ་ག་བྡ་རམ་ཚར་ཡིན་པས་ལབ་རེད་ད་རཱ། ཨེ་ནས་ཁོ་ཡིས་འོ་ོང་ལ་མོག་མོག
STT_CS-D-2010-M-D-B07-4-R-01_0084_619185_to_627370,ཅོ་མཱན་འདི་དགོས་ལབ་རེད། ཨེ་ནས་སྒྲུང་རྫོགས་རེད། ཨེ་ནས། དེའི་འོག་དེ་ལ་འཛམ་གླིང་བཅུ་བཞི་ཀོ་མན་གཅིག་ཡོད་ས་རཱ། བཅུ་བཞི་དེ་ལ་ཨན་འདྲའི་ལབ་རེད་ད་རཱ།  ,co mAn 'di dgos lab red/_e nas sgrung rdzogs red/_e nas/_de'i 'og de la 'dzam gling bcu bzhi ko man gcig yod sa rA/_bcu bzhi de la an 'dra'i lab red da rA/__,https://d38pmlk0v88drf.cloudfront.net/wav16k/STT_CS-D-2010-M-D-B07-4-R-01_0084_619185_to_627370.wav,STT_CS,3,142,8.185,wav16k/STT_CS-D-2010-M-D-B07-4-R-01_0084_619185_to_627370.wav,ཆའ་མེན་འདི་དགོས་ལབ་རེད། ཨ་ནས་སྒྲུང་རྫོགས་རེད། ཨེ་ནས། དི་འག་དེ་ལ་པ་བཅུ་བཞི། ད་ཁ་མི་འདྲ་བོ་ཡིན་ས་རཱ། བཅུ་བཞི་དེ་ལ་ཨེ་འདྲའི་ལབ་རེད་ད་རཱ།
STT_NS0066_0073_450950_to_457371,ཨུན་རེད་རེད། འདི་བ་ལ་དམིགས་བསལ་གིས་ཞིམ་པོ་ཡོད་རེད་ལབ་ཀི་འདུག་བ་རེད་བ། ལྷོ་ཕྱོགས། འདི་ལ་ཡང་ཁོ་ཚོའི་འདི་རེད་ད་དམིགས་བསལ་གིས་མར་དེ་ཡང་ཁྱད་ཆོས་ལོགས་ཀ་རེད་ཤག་ད། ཨ་ལེ་ ,un red red/_'di ba la dmigs bsal gis zhim po yod red lab ki 'dug ba red ba/_lho phyogs/_'di la yang kho tsho'i 'di red da dmigs bsal gis mar de yang khyad chos logs ka red shag da/_a le _,https://d38pmlk0v88drf.cloudfront.net/wav16k/STT_NS0066_0073_450950_to_457371.wav,STT_NS,3,162,6.421,wav16k/STT_NS0066_0073_450950_to_457371.wav,འདོད་བ་ལབ་རེདམིགས་བསལ་གི་ཞིམ་པོ་ཡོད་རེད་ལབ་ཀི་འདུག་བ་རེ།་། དེ་ལ་ཡང་ཁོ་ཚོ་འདི་རེད་འད། དམིགས་བསལ་གི་མར་དེ་ཡང་ཁྱད་ཆོས་ལོགས་ཀ་རེད་ཤག་ ཨ་ལེ།
STT_NS0066_0074_457506_to_466956,ཁ་ལག་གི་ནང་གཙོ་བོ་དེ་མར་བླུག་གོ་རེད་བ། རེད་རེད་རེད། ཁོང་ཚོའི་འདི་ལ་མར་དེ་ཁྱད་ཆོས་ཡ་ཡུད་འདུག་བ། རེད་རེད། མར་རྦད་ལོགས་ཀ་རེད་ཤག ཨེ་ནས་ཡ་ཡུད་གོང་ཆེན་པོ། རེད་རེད། ཨུན་རེད་རེད། ཨེ་ནས་ཨོ་དེ་གཅིག་མངགས་ན་འགྲིག་ས་རེད།  ,kha lag gi nang gtso bo de mar blug go red ba/_red red red/_khong tsho'i 'di la mar de khyad chos ya yud 'dug ba/_red red/_mar rbad logs ka red shag_e nas ya yud gong chen po/_red red/_un red red/_e nas o de gcig mngags na 'grig sa red/__,https://d38pmlk0v88drf.cloudfront.net/wav16k/STT_NS0066_0074_457506_to_466956.wav,STT_NS,3,209,9.45,wav16k/STT_NS0066_0074_457506_to_466956.wav,ཁ་ལག་གི་ནང་གཙོ་བོ་དེ་མར་བླུགས་ི་ཡོད་རེད་། རེད་རེད་རེད། ཁོ་ཚོ་དེ་ལ་མར་དེ་ཁྱད་ཆོས་ཡ་ཡུད་འདུག་བ། རེརེད། མར་རྦད་དེ་ལོགས་ཀ་རེད་ཤག ཨེ་ནས་ཡ་ཡུད་གོང་ཆེན་པོ། རེད་རེད། ཨུ རེད་རེད འོ་དེ་གཅིག་མངངས་ན་འགྲིག་ས་རེད།
STT_NS0066_0188_1253365_to_1256385,ཆུ་ཚོད་གཅིག་མ་རེད། སྐར་མ་ག་ཚོད་ན་ཅིག་ལ་མོ་མཐོང་ཡ་མི་འདུག་ལབ་སོང་།  ,chu tshod gcig ma red/_skar ma ga tshod na cig la mo mthong ya mi 'dug lab song /__,https://d38pmlk0v88drf.cloudfront.net/wav16k/STT_NS0066_0188_1253365_to_1256385.wav,STT_NS,3,67,3.02,wav16k/STT_NS0066_0188_1253365_to_1256385.wav,ཆུ་ཚོད་གཅིག་མ་རེད། སྐར་མ་ག་ཚོད་ཡིན་གཅིག་ལ་མོ་མཐོང་ཡ་མི་འདུག་ལབ་སོང་།
STT_NS0066_0189_1257010_to_1263490,རུས་ཀོག་འདྲ་བོ་གཅིག་གཉིས་ཅིག ཨ་མ། ཨེ་ནས་དུགས་སློག་དེ་ཚོ་ལྷག་ཤག་ལབ་སོང་། ཞེད་སྣང་ཚ་བ་ལ། དེ་ག་རང་ལ་ཨེ་ནས་ཕཱར་དེང་སང་གློག་བརྙན་འདི་ ,rus kog 'dra bo gcig gnyis cig_a ma/_e nas dugs slog de tsho lhag shag lab song /_zhed snang tsha ba la/_de ga rang la e nas phAr deng sang glog brnyan 'di _,https://d38pmlk0v88drf.cloudfront.net/wav16k/STT_NS0066_0189_1257010_to_1263490.wav,STT_NS,3,129,6.48,wav16k/STT_NS0066_0189_1257010_to_1263490.wav,རུས་ཁོག་འདྲ་བོ་གཅིག་གཉིས་སྡད། ཨེ་ནས་དུག་སློག་དེ་ཚོ་ལྷག་ཤོག་ལབ་སོང་། ཞེད་སྣང་ཚ་བོ་། ད་ག་རང་ལ་ཨེ་ནསདཔར་པོ་ད་དེང་སང་གློག་བརྙན་དེ་
STT_NS0066_0190_1267911_to_1270375,ཨུན། ཉེན་རྟོག་པ་དེ་ཚོ་དང་། དེ་ཚོ་ཚང་མ་སླེབས།  ,un/_nyen rtog pa de tsho dang /_de tsho tshang ma slebs/__,https://d38pmlk0v88drf.cloudfront.net/wav16k/STT_NS0066_0190_1267911_to_1270375.wav,STT_NS,3,46,2.464,wav16k/STT_NS0066_0190_1267911_to_1270375.wav,ཨུནཉེན་རྟོག་པ་དེ་ཚོ་དང་དེ་ཚོ་ཚང་མ་སླེབས།
STT_NS0066_0191_1270662_to_1279420,ཨེ་ནས། འདུག་སེ་བྱས། ཨ་ལེ། ད་ཨོ་ཁྱི་དེ་ཧང་སང་ཡ་དེ་ཆགས་འདུག་བ་ག་རེ་ལབ་དགོས་རེད། རེད་རེད། ཞེད་སྣང་ཚ་བོ་རེད། ཞེད་སྣང་ཚ་བོ་ཅིག་ཆགས་འདུག་བ། རེད་རེད་རེད། གནོད་སྐྱོན་ཆེན་པོ་བྱེད་མྱི། ཨུན་རེད།  ,e nas/_'dug se byas/_a le/_da o khyi de hang sang ya de chags 'dug ba ga re lab dgos red/_red red/_zhed snang tsha bo red/_zhed snang tsha bo cig chags 'dug ba/_red red red/_gnod skyon chen po byed myi/_un red/__,https://d38pmlk0v88drf.cloudfront.net/wav16k/STT_NS0066_0191_1270662_to_1279420.wav,STT_NS,3,185,8.758,wav16k/STT_NS0066_0191_1270662_to_1279420.wav,ཨེ་ནས་འདུག་སེ་བྱས་རེད ད་ཁྱི་དེ་ཧང་སང་ཡ་དི་ཆགས་འདུག་བ་ག་རེ་ལབ་དགོས་རེད། རེད་རེད། ་ཚོ་་ལ་་ོ་རེད། ཞེད་སྣང་ཚ་བོ་ཅིག་པས་ཆགས་འདུག་བ། རེད་རེད གནོད་སྐྱོན་ཆེན་པོ་ཅེད་རེད།
STT_NS0066_0192_1279420_to_1288178,རེད་རེད། ད་དེང་སང་ཨེ་འདྲའི་འདྲ་བོ་རེད་འདུག་རེད་བ་ཡ། ཨུན། ག་བ་འགྲོ་ན་ད་ལྟ་ཁྱི་དེ། མི་དེ་ཚོ་ནི་ཁྱི་དགའ་བ་ཅིག་བྱེད་ཀི་འདུག་རེད་བ། ཁྱི་དེ་ཚོ་ནི་མ་ཉན་པ་བྱས། ཧ་ཧ། ཁྱི་ཁ་ཤས་ཡག་པོ་ཨེ་འདྲའི་ཡོད་ ,red red/_da deng sang e 'dra'i 'dra bo red 'dug red ba ya/_un/_ga ba 'gro na da lta khyi de/_mi de tsho ni khyi dga' ba cig byed ki 'dug red ba/_khyi de tsho ni ma nyan pa byas/_ha ha/_khyi kha shas yag po e 'dra'i yod _,https://d38pmlk0v88drf.cloudfront.net/wav16k/STT_NS0066_0192_1279420_to_1288178.wav,STT_NS,3,186,8.758,wav16k/STT_NS0066_0192_1279420_to_1288178.wav,རེད། རེད་རེད། ད་དེང་སང་ཨེ་འདྲའི་འདྲ་བོ་རེད་འདུག་རེད་ཡ།། ག་བ་འགྲོ་ནས་ད་་ཁྱི་དེ་མི་དེ་ཚོ་ནི་ཁྱི་དགའ་བ་བྱེད་ཀི་འདུག་རེད་། ཁྱི་དེ་ཚོ་ནི་མ་ཉན་པ་བྱས། ཁྱི་ཁ་ཤས་ཡག་པོ་ཨེ་འདྲའི་ཡོད་ར།
STT_NS0066_0193_1288178_to_1296936,རེད་བ་ཡ། ང་ཚོ་བོད་ལ་ཡིན་ན། རེད་རེད་རེད། ནང་མི་རེ་ལ་ཁྱི་མེད་བ་གཅིག་ག་ཡོད་བ་མ་རེད། རེད་རེད། ཁྱི་མང་ཆེ་ཤོས་ནང་ལྟ་མྱི་ཆེད་དུ་བཞག་གི་རེད་རེད་བ་ཡ། ཨུན། བོད་ལ་ནི་རྐུན་མ་འདྲ་བོ་ ,red ba ya/_nga tsho bod la yin na/_red red red/_nang mi re la khyi med ba gcig ga yod ba ma red/_red red/_khyi mang che shos nang lta myi ched du bzhag gi red red ba ya/_un/_bod la ni rkun ma 'dra bo _,https://d38pmlk0v88drf.cloudfront.net/wav16k/STT_NS0066_0193_1288178_to_1296936.wav,STT_NS,3,170,8.758,wav16k/STT_NS0066_0193_1288178_to_1296936.wav,རེད་བ་ཡ། ང་ཚོ་བོད་ལ་ཡིན་ན་ནང་མི་རེ་ལ་ཁྱི་མེད་པ་གཅིག་ཡ་ཡོད་མ་རེད། རེད་རེད། ཁྱི་མང་ཆེ་ཤོས་ནང་ལྟ་མྱི་ཆེད་དུ་བཞག་གི་རེད་རེད་ཡ། བོད་ལ་ཡིན་ན་རྐུན་མ་འདྲ་བོ་ཞིག་
STT_NS0066_0194_1296936_to_1305694,དམིགས་བསལ་ཡོད་མ་རེད་ད། མི་མ་འཛུལ་ཡ་དེ་འདྲ་དང་། ཡིན་ནས་སྤང་ཁྱི་ད་ཡོད་ར་ཡོད་རེད་ད། ཡིན་ནས་ཁྱི་ལ་རྨུག་ཡ་ད། རྨུག་མྱི་ཁ་ཤས་ཡོད་རེད་རེད་བ། ང་འདྲ་ཡིན་ན་ད་འདི།  ,dmigs bsal yod ma red da/_mi ma 'dzul ya de 'dra dang /_yin nas spang khyi da yod ra yod red da/_yin nas khyi la rmug ya da/_rmug myi kha shas yod red red ba/_nga 'dra yin na da 'di/__,https://d38pmlk0v88drf.cloudfront.net/wav16k/STT_NS0066_0194_1296936_to_1305694.wav,STT_NS,3,153,8.758,wav16k/STT_NS0066_0194_1296936_to_1305694.wav,དམིགས་བསལ་ཡོད་མ་རེད་ད། མི་མ་འཛུལ་ཡ་དེ་འདྲ་དང་ཡིནནས་སྤང་ཁྱི་ད་ཡོད་རེད་ཡོད་རེད་ད། ཡིན་ནས་ཁྱི་ལ་བྨུག་ཡ་ད་ྨུག་མྱི་ཁ་ཤས་ཡོད་རེད་རེ་བ། ང་འདྲ་བོ་ལ་ཡིན་ན་ད་དེ་
STT_TT00103_02748.400-02749.150,ཁོངས་ཡངས་པ།  ,khongs yangs pa/__,https://d38pmlk0v88drf.cloudfront.net/wav16k/STT_TT00103_02748.400-02749.150.wav,STT_TT,3,13,0.75,wav16k/STT_TT00103_02748.400-02749.150.wav,ཁོང་ཡངས་པ།
STT_TT00103_02749.800-02752.100,ཅི་ཡོད་བླ་མའི་ཕྱོགས་སུ་གཏོང་བས་གཏོང་ཕོད་ཆེ།  ,ci yod bla ma'i phyogs su gtong bas gtong phod che/__,https://d38pmlk0v88drf.cloudfront.net/wav16k/STT_TT00103_02749.800-02752.100.wav,STT_TT,3,45,2.299999999999727,wav16k/STT_TT00103_02749.800-02752.100.wav,ཅི་ཡོད་བླ་མའི་ཕྱོགས་སུ་གཏོང་བས་གཏོང་ཕོད་ཆེ་
STT_TT00103_02752.650-02754.000,བློ་སྣ་མ་དག་པའི།  ,blo sna ma dag pa'i/__,https://d38pmlk0v88drf.cloudfront.net/wav16k/STT_TT00103_02752.650-02754.000.wav,STT_TT,3,18,1.349999999999909,wav16k/STT_TT00103_02752.650-02754.000.wav,བློ་སྣ་མ་དག་པའི་
STT_TT00103_02754.500-02756.450,སྐྱོན་རྟོག་དང་མི་མངའ་བས་དག་སྣང་ལྡན་པ།  ,skyon rtog dang mi mnga' bas dag snang ldan pa/__,https://d38pmlk0v88drf.cloudfront.net/wav16k/STT_TT00103_02754.500-02756.450.wav,STT_TT,3,39,1.949999999999818,wav16k/STT_TT00103_02754.500-02756.450.wav,སྐྱོན་ལྟོག་མི་མངའ་བས། དག་སྣང་དང་ལྡན་པ།
STT_TT00103_02710.850-02713.600,གོ་ཆ་ཆེ་ལ་བློ་གྲོས་ཤིན་ཏུ་བརྟན། ལུས་དང་སྲོག་ལ་མི་བལྟ་རིམ་ ,go cha che la blo gros shin tu brtan/_lus dang srog la mi blta rim _,https://d38pmlk0v88drf.cloudfront.net/wav16k/STT_TT00103_02710.850-02713.600.wav,STT_TT,3,58,2.75,wav16k/STT_TT00103_02710.850-02713.600.wav,གོ་ཆ་ཆེ་ལ་བློ་གྲོས་ཤིན་ཏུ་བརྟན། ལུས་དང་སྲོག་ལ་མི་ལྟ་རིམ་
STT_TT00103_02715.600-02718.600,བདག་ཉིད་མི་སྲུང་བའི། སྐྱེས་བུ་དེ་ནི་མོས་གུས་ཁོ་ནས་གྲོལ། ཞེས་སོ།  ,bdag nyid mi srung ba'i/_skyes bu de ni mos gus kho nas grol/_zhes so/__,https://d38pmlk0v88drf.cloudfront.net/wav16k/STT_TT00103_02715.600-02718.600.wav,STT_TT,3,65,3.0,wav16k/STT_TT00103_02715.600-02718.600.wav,བདག་ཉིད་མི་སཟུང་བའས། སྐྱེས་བུ་དེ་ནི་མོས་གུས་ཁོ་ནས་གྲོལ། ཞེས་སོ།
STT_TT00103_02757.250-02757.900,ཉེས་སྤྱོད།  ,nyes spyod/__,https://d38pmlk0v88drf.cloudfront.net/wav16k/STT_TT00103_02757.250-02757.900.wav,STT_TT,3,12,0.650000000000091,wav16k/STT_TT00103_02757.250-02757.900.wav,ཉེས་སྤྱོད།
STT_TT00103_02758.200-02759.250,མི་དགེ་བའི་ལས།  ,mi dge ba'i las/__,https://d38pmlk0v88drf.cloudfront.net/wav16k/STT_TT00103_02758.200-02759.250.wav,STT_TT,3,16,1.050000000000182,wav16k/STT_TT00103_02758.200-02759.250.wav,མི་དགེ་བའི་ལས་
STT_TT00103_02759.500-02760.000,བྱས་ན།  ,byas na/__,https://d38pmlk0v88drf.cloudfront.net/wav16k/STT_TT00103_02759.500-02760.000.wav,STT_TT,3,8,0.5,wav16k/STT_TT00103_02759.500-02760.000.wav,བྱས་ན་
STT_NS0066_0195_1306150_to_1311668,ང་བོད་ལ་བསྡད་དུས་ཙམ་པ་ལ་རྨུག་མྱོང་ཡོད་རེད་བ་ཡ། ཨུན། ད་དེ་དུས་ཙམ་པ་ལ་ང་ཚོ་ཞིང་ཁ་བཏབས་ཚར་ནས་ཨེ་ནས་བཙས་མ་ ,nga bod la bsdad dus tsam pa la rmug myong yod red ba ya/_un/_da de dus tsam pa la nga tsho zhing kha btabs tshar nas e nas btsas ma _,https://d38pmlk0v88drf.cloudfront.net/wav16k/STT_NS0066_0195_1306150_to_1311668.wav,STT_NS,3,103,5.518,wav16k/STT_NS0066_0195_1306150_to_1311668.wav,ང་བོད་ལ་བསྡད་དུས་ཙམ་པ་ལ་སྨུགས་མྱོང་ཡོད་རེད་བ་ཡ། ཨུན་། ད་དེ་དུས་ཙམ་པ་ལ་ང་ཚོ་ཞིང་ཁ་བཏབ་ཚར་ནས་ཨེ་ནས་བཙས་མ་
STT_NS0066_0196_1311668_to_1317186,རྔ་ས་ནས་ཡོད་བ། ཨུན། ཞིང་བརྔས་ཚར་བའི་རྗེས་ལ་འབྲུ་དང་རྩྭ་དབྱེ་བ་བྱེད་ཡ་གི་དུས་ཚོད་ཅིག་ཡོད་བ། ཨུན། དེ་དུས་ཡོད་རེད།  ,rnga sa nas yod ba/_un/_zhing brngas tshar ba'i rjes la 'bru dang rtswa dbye ba byed ya gi dus tshod cig yod ba/_un/_de dus yod red/__,https://d38pmlk0v88drf.cloudfront.net/wav16k/STT_NS0066_0196_1311668_to_1317186.wav,STT_NS,3,113,5.518,wav16k/STT_NS0066_0196_1311668_to_1317186.wav,ལྔ་ཚར་ནི་ཡོད་བ། ུ། བཞི་ལྔ་ཚར་བའི་རྗེས་ལ་འབྲུ་དང་རྩྭ་དབྱེ་བ་བྱེ་ཡ་དུས་ཚོད་ཅིག་ཡོད་བ། ཨུན། དེ་དུས་རེད།
STT_NS0068_0053_367461_to_376371,ཨ་ལེ། ཡང་སྙིང་རྗེ་ད་ལམ་ཁ་ལ་བོད་པའི་མི་དེ་ཚོ་སེམས་པ་བཟང་པོ་འདུག་བ། རེད་རེད། ཁོ་རང་ཚོ་སྙིང་རྗེ་ག་རེ་ཟ་ཡ་ཡོད་ལེ་མེད་ན་ང་ཚོར་ང་ཚོ་ལ་སྤྲད་ཁ་བྱས། དེ་འདྲས་བྱས་ནས་ཡོང་རྒྱོ་རེད།  ,a le/_yang snying rje da lam kha la bod pa'i mi de tsho sems pa bzang po 'dug ba/_red red/_kho rang tsho snying rje ga re za ya yod le med na nga tshor nga tsho la sprad kha byas/_de 'dras byas nas yong rgyo red/__,https://d38pmlk0v88drf.cloudfront.net/wav16k/STT_NS0068_0053_367461_to_376371.wav,STT_NS,3,170,8.91,wav16k/STT_NS0068_0053_367461_to_376371.wav,ཨ་ལེལ། ཡང་སྙིང་རྗེ་ད་ལམ་ཁ་ལ་བོད་པ་མི་དེ་ཚོ་སེམས་པ་བཟང་པོ་འདུག་བ། ཁོ་རང་ཚོ་སྙིང་རྗེ་ག་རེ་བཟ་ཡ་ཡོད་མེད་ན་ ང་ཚོ་ང་ཚོ་ལ་སྤྲད་ཀ་བྱས། དེ་འདྲ་གི་བྱས་ནས་ཡོང་རྒྱོ་རེད།
STT_NS0068_0054_376607_to_379729,རེད་རེད་རེད། ཨེ་ནས་དེ་དགོང་ད་དེ་ཚོ་ཉལ་དུས་སྐབས་སུ་དེ་འདྲའི་ ,red red red/_e nas de dgong da de tsho nyal dus skabs su de 'dra'i _,https://d38pmlk0v88drf.cloudfront.net/wav16k/STT_NS0068_0054_376607_to_379729.wav,STT_NS,3,60,3.122,wav16k/STT_NS0068_0054_376607_to_379729.wav,རེད་རེད་རེད། ཨེ་ནས་དེ་དགོང་ད་དེ་ཚོ་ཉལ་དུས་སྐབས་སུ་དེ་འདྲའི་
STT_NS0068_0055_382750_to_386310,མེ་ཆས། ཉལ་དུས་སྐབས་སུ་ཡིན་ན་རེད། ཉལ་དུས་སྐབས་སུ་མེ་ཆས་དང་ཨེ་ནས་དེ་ ,me chas/_nyal dus skabs su yin na red/_nyal dus skabs su me chas dang e nas de _,https://d38pmlk0v88drf.cloudfront.net/wav16k/STT_NS0068_0055_382750_to_386310.wav,STT_NS,3,67,3.56,wav16k/STT_NS0068_0055_382750_to_386310.wav,ཉལ་དུས་སྐབས་སུ་ཡིན་ན་རེད། ཉལ་དུས་སྐབས་སུ་མེལ་ཆས་དང་ཨེ་ནས་དེ་
STT_NS0068_0056_387289_to_390158,ཕར་ཚུར་འགྲོ་དུས་ད་སོ་སོས་གྱོན་ཡ་གི་གྱོན་ཆས་དེ་ཚོ ,phar tshur 'gro dus da so sos gyon ya gi gyon chas de tsho_,https://d38pmlk0v88drf.cloudfront.net/wav16k/STT_NS0068_0056_387289_to_390158.wav,STT_NS,3,49,2.869,wav16k/STT_NS0068_0056_387289_to_390158.wav,ཕར་ཚུར་འགྲོ་དུས་ད་སོ་སོ་གྱོན་ཡ་གི་གྱོན་ཆས་དེ་ཚོ་
STT_NS0068_0057_390900_to_394562,མཐུག་པོ་འདྲ་བོ་གྱོན་ཡོད་རེད། ཨེ་ནས། ཡང་མ་གཏོགས་གྲང་ངར་གི་དེ་འདྲའི། ཁྱེད་རང་ལ་ཡང་དེ་འདྲའི་ ,mthug po 'dra bo gyon yod red/_e nas/_yang ma gtogs grang ngar gi de 'dra'i/_khyed rang la yang de 'dra'i _,https://d38pmlk0v88drf.cloudfront.net/wav16k/STT_NS0068_0057_390900_to_394562.wav,STT_NS,3,90,3.662,wav16k/STT_NS0068_0057_390900_to_394562.wav,མཐུག་པོ་འདྲ་བོ་གྱོན་ཡོད་རེད། ཨེ་ནས་ཡང་མ་གཏོགས་གྲངས་ངར་གི་དེ་འདྲའི་ཁྱོད་རང་ལ་ཡང་དེ་འདྲའི་
STT_NS0068_0058_395018_to_397060,གྲང་ངར་དེ་འདྲའི་ཕོག་སོང་བེ། ག་འདྲས་བྱས་སོང་། ཨུན།  ,grang ngar de 'dra'i phog song be/_ga 'dras byas song /_un/__,https://d38pmlk0v88drf.cloudfront.net/wav16k/STT_NS0068_0058_395018_to_397060.wav,STT_NS,3,51,2.042,wav16k/STT_NS0068_0058_395018_to_397060.wav,གྲངས་ངར་དེ་འདྲའི་ཕོག་སོང་བེ། ག་འདྲའི་བྱས་སོང་། ཨུན།
STT_NS0068_0059_397414_to_405649,ད་ལམ་ཁ་ལ་འགྲོ་དུས་ཙམ་པ་ལ་ང་ཚོས་སྤྱིར་བཏང་མང་པོ་དུགས་སློང་ང་ཚོས་སྔན་མ་གི་ད་ད་ལྟ་ཁེར་བ་ནང་བཞིན། བརྡ་སྐྱེལ་མི་དེ་ཚོས་ཁེར་བ་ནང་བཞིན་ཁེར་ཡ་ཨེ་འདྲའི་ཡོད་ ,da lam kha la 'gro dus tsam pa la nga tshos spyir btang mang po dugs slong nga tshos sngan ma gi da da lta kher ba nang bzhin/_brda skyel mi de tshos kher ba nang bzhin kher ya e 'dra'i yod _,https://d38pmlk0v88drf.cloudfront.net/wav16k/STT_NS0068_0059_397414_to_405649.wav,STT_NS,3,148,8.235,wav16k/STT_NS0068_0059_397414_to_405649.wav,ད་ལམ་ཁ་ལ་འགྲོ་དུས་ཙམ་པ་ལ་ང་ཚོ་སྤྱིར་བཏང་མང་པོ་དུག་སློག་ང་ཚོ་སྔོན་མ་་ད་ད་ལྟ་འཁུར་བ་ནང་བཞིན་ལྡབ་ཕྱིས་མི་དེ་ཚོ་འཁུར་བ་ནང་བཞིན་ཁེར་ཡ་ཨེ་འདྲའི་ཡོད་མ་།
STT_NS0068_0060_405649_to_413884,མ་རེད་རེད་བ་ཡ། ཨུན། ད་ང་ཚོ་བརྗེ་ལེན་བྱེད་ཡ་གཉིས་ཟི་ཡོད་ན། རེད་རེད། གོས་ཐུང་གཉིས་དེ་འདྲའི་འདྲ་བོ་ཡོད་ན་གཅིག་བྷེགྷྀ་ལ་བླུགས་གཅིག་མཐུག་པོ་གོན། ཉིན་གུང་སྲབ་སྲབ་གོན། དགོང་ད་ ,ma red red ba ya/_un/_da nga tsho brje len byed ya gnyis zi yod na/_red red/_gos thung gnyis de 'dra'i 'dra bo yod na gcig b+heg+h-i la blugs gcig mthug po gon/_nyin gung srab srab gon/_dgong da _,https://d38pmlk0v88drf.cloudfront.net/wav16k/STT_NS0068_0060_405649_to_413884.wav,STT_NS,3,169,8.235,wav16k/STT_NS0068_0060_405649_to_413884.wav,མ་རེད་རེད་བ་ཡ། ཨུན། ད་ང་ཚོ་རྗེས་ལ་རྒྱག་ཡ་གཉིས་ཙི་ཡོད་ན། རེད་རེད། དོ་ཐུང་གཉིས་དེ་འདྲའི་འདྲ་བོ་ཡིན་ན་གཅིག་ྦེག་ལ་བླུགས གཅིག་མཐུག་པོ་གོན། ཉིན་གུང་ཀྲབ་ཀྲབ་དགོན། དགོང་ད
